{
  "plan": {
    "recommendation_method": "conservative_4_week",
    "weekly_target_cents": 9000,
    "status": "active",
    "goal": {
      "mode": "coverage",
      "weeks": 4
    },
    "goal_expense_baseline_cents": 65000,
    "updated_at": null
  },
  "recommendation": {
    "status": "ready",
    "method": "conservative_4_week",
    "amount_cents": 9000,
    "latest_surplus_cents": 48000,
    "history_weeks_used": 4,
    "as_of_week_start": "2026-08-24",
    "rationale_code": "four_week_median_capped_by_latest"
  },
  "progress": {
    "contribution_total_cents": 12500,
    "goal_target_cents": 280000,
    "progress_percent": 4.5,
    "coverage_days": 1.3,
    "coverage_weeks": 0.2
  },
  "goal_review": {
    "status": "expenses_changed",
    "previous_weekly_expenses_cents": 65000,
    "current_weekly_expenses_cents": 70000,
    "expense_change_cents": 5000
  },
  "completion_projection": {
    "status": "projected",
    "projected_date": "2027-04-20",
    "weeks_remaining": 33,
    "remaining_cents": 267500
  },
  "milestones": [
    { "percentage": 25, "target_cents": 70000, "reached": false },
    { "percentage": 50, "target_cents": 140000, "reached": false },
    { "percentage": 75, "target_cents": 210000, "reached": false },
    { "percentage": 100, "target_cents": 280000, "reached": false }
  ],
  "weekly_essential_expenses_cents": 70000,
  "contributions": [
    {
      "id": "fixture-withdrawal-1",
      "entry_type": "withdrawal",
      "amount_cents": 2500,
      "contribution_date": "2026-09-01",
      "note": "Urgent transport repair",
      "created_at": "2026-09-01T01:00:00+00:00",
      "updated_at": "2026-09-01T01:00:00+00:00"
    },
    {
      "id": "fixture-contribution-2",
      "entry_type": "deposit",
      "amount_cents": 10000,
      "contribution_date": "2026-08-25",
      "note": "Weekly contribution",
      "created_at": "2026-08-25T01:00:00+00:00",
      "updated_at": "2026-08-25T01:00:00+00:00"
    },
    {
      "id": "fixture-contribution-1",
      "entry_type": "deposit",
      "amount_cents": 5000,
      "contribution_date": "2026-08-18",
      "note": "First step",
      "created_at": "2026-08-18T01:00:00+00:00",
      "updated_at": "2026-08-18T01:00:00+00:00"
    }
  ]
}
